{
 "version": 1,
 "kind": "cutflow-effect-catalog",
 "sourceDoc": "sources/剪映效果名-原始清单.md",
 "stats": {
  "total": 317,
  "status": {
   "不实现": 78,
   "可执行": 186,
   "登记待实现": 53
  },
  "tier": {
   "T1": 162,
   "T2": 77,
   "T3": 78
  },
  "source": {
   "用户清单": 257,
   "补充清单": 60
  },
  "subclass": {
   "T2候选": 40,
   "基础": 110,
   "已确认删除": 42,
   "标准NLE": 41,
   "特效": 53,
   "组合": 11,
   "运镜": 19,
   "遮罩": 1
  },
  "domain": {
   "artboard": 37,
   "audio": 5,
   "element": 7,
   "render": 260,
   "subtitle": 8
  },
  "category": {
   "combo": 17,
   "in": 54,
   "out": 27,
   "transition": 141,
   "unknown": 78
  },
  "executable": 186
 },
 "effects": [
  {
   "id": "blur.axis",
   "label": "纵拉模糊",
   "category": "in",
   "subclass": "运镜",
   "aliases": [
    "垂直模糊",
    "纵拉模糊"
   ],
   "tier": "T1",
   "status": "可执行",
   "fxId": "blur.axis",
   "params": {
    "dir": "v",
    "durMs": 500
   },
   "usage": [],
   "commonness": "中",
   "why": null,
   "source": "用户清单",
   "license": null,
   "domain": "render",
   "note": "avgblur 各向异性(sizeX/sizeY);gblur 无方向",
   "originName": null
  },
  {
   "id": "blur.axis.h",
   "label": "横拉模糊出场",
   "category": "out",
   "subclass": "运镜",
   "aliases": [],
   "tier": "T1",
   "status": "可执行",
   "fxId": "blur.axis.h",
   "params": {
    "dir": "h",
    "durMs": 500
   },
   "usage": [],
   "commonness": "中",
   "why": null,
   "source": "用户清单",
   "license": null,
   "domain": "render",
   "note": null,
   "originName": null
  },
  {
   "id": "blur.in.focus",
   "label": "模糊聚焦",
   "category": "in",
   "subclass": "运镜",
   "aliases": [
    "模糊放大",
    "模糊聚焦",
    "模糊收缩"
   ],
   "tier": "T1",
   "status": "可执行",
   "fxId": "blur.in.focus",
   "params": {
    "durMs": 700,
    "sigma": 14
   },
   "usage": [],
   "commonness": "中",
   "why": null,
   "source": "用户清单",
   "license": null,
   "domain": "render",
   "note": "模糊+缩放组合的 T1 近似(纯模糊档)",
   "originName": null
  },
  {
   "id": "dissolve.in",
   "label": "叠化入场",
   "category": "in",
   "subclass": "基础",
   "aliases": [
    "叠化(单片段)",
    "溶解(单片段)",
    "熄灭"
   ],
   "tier": "T1",
   "status": "可执行",
   "fxId": "dissolve.in",
   "params": {
    "durMs": 500,
    "alpha": true
   },
   "usage": [],
   "commonness": "中",
   "why": null,
   "source": "用户清单",
   "license": null,
   "domain": "render",
   "note": "叠化本质是转场;单片段 alpha 版,拼接场景用 tr.dissolve.cross",
   "originName": null
  },
  {
   "id": "dither.out",
   "label": "飘散消散",
   "category": "out",
   "subclass": "基础",
   "aliases": [
    "飘散",
    "散景消散",
    "消散成花"
   ],
   "tier": "T1",
   "status": "可执行",
   "fxId": "dither.out",
   "params": {
    "durMs": 600,
    "sigma": 12
   },
   "usage": [],
   "commonness": "中",
   "why": null,
   "source": "用户清单",
   "license": null,
   "domain": "render",
   "note": "近似档:淡出+模糊;真飘散粒子 T2",
   "originName": null
  },
  {
   "id": "effect.chroma.split",
   "label": "色散重影",
   "category": "combo",
   "subclass": "特效",
   "aliases": [
    "色散重影",
    "色差扩光",
    "色差 RGB",
    "色差流波"
   ],
   "tier": "T1",
   "status": "可执行",
   "fxId": "effect.chroma.split",
   "params": {
    "shift": 4
   },
   "usage": [],
   "commonness": "中",
   "why": null,
   "source": "用户清单",
   "license": null,
   "domain": "render",
   "note": null,
   "originName": null
  },
  {
   "id": "effect.drip.ink",
   "label": "水墨(近似)",
   "category": "in",
   "subclass": "特效",
   "aliases": [
    "滴墨入画",
    "泼墨开场",
    "墨水",
    "水墨(入场)"
   ],
   "tier": "T1",
   "status": "可执行",
   "fxId": "effect.drip.ink",
   "params": {
    "durMs": 800,
    "sigma": 10
   },
   "usage": [],
   "commonness": "中",
   "why": null,
   "source": "用户清单",
   "license": null,
   "domain": "render",
   "note": "近似档;真水墨 T2(分册02 §3.3 注明近似)",
   "originName": null
  },
  {
   "id": "effect.exposure.bloom",
   "label": "过曝消散",
   "category": "in",
   "subclass": "特效",
   "aliases": [
    "过曝消散",
    "曝光拉丝",
    "光幕爆发",
    "强光擦除",
    "过曝模糊"
   ],
   "tier": "T1",
   "status": "可执行",
   "fxId": "effect.exposure.bloom",
   "params": {
    "durMs": 700
   },
   "usage": [],
   "commonness": "中",
   "why": null,
   "source": "用户清单",
   "license": null,
   "domain": "render",
   "note": null,
   "originName": null
  },
  {
   "id": "effect.freeze.frame",
   "label": "拍照定格",
   "category": "in",
   "subclass": "特效",
   "aliases": [
    "拍照定格",
    "定格"
   ],
   "tier": "T1",
   "status": "可执行",
   "fxId": "effect.freeze.frame",
   "params": {
    "freezeMs": 600
   },
   "usage": [],
   "commonness": "中",
   "why": null,
   "source": "用户清单",
   "license": null,
   "domain": "render",
   "note": "与 freezeMs(ADR-0027)同一能力,合并登记",
   "originName": null
  },
  {
   "id": "effect.glitch.exit",
   "label": "故障退出",
   "category": "out",
   "subclass": "特效",
   "aliases": [
    "故障退出"
   ],
   "tier": "T1",
   "status": "可执行",
   "fxId": "effect.glitch.exit",
   "params": {
    "durMs": 500,
    "shift": 8
   },
   "usage": [],
   "commonness": "中",
   "why": null,
   "source": "用户清单",
   "license": null,
   "domain": "render",
   "note": null,
   "originName": null
  },
  {
   "id": "effect.glitch.rgb",
   "label": "RGB 故障入场",
   "category": "in",
   "subclass": "特效",
   "aliases": [
    "变色故障",
    "RGB故障",
    "信号失真",
    "故障抖动"
   ],
   "tier": "T1",
   "status": "可执行",
   "fxId": "effect.glitch.rgb",
   "params": {
    "durMs": 500,
    "shift": 8
   },
   "usage": [],
   "commonness": "中",
   "why": null,
   "source": "用户清单",
   "license": null,
   "domain": "render",
   "note": null,
   "originName": null
  },
  {
   "id": "effect.glow.halo",
   "label": "辉光光晕",
   "category": "in",
   "subclass": "特效",
   "aliases": [
    "辉光渐消",
    "纵深光晕",
    "光尘弹跳"
   ],
   "tier": "T1",
   "status": "可执行",
   "fxId": "effect.glow.halo",
   "params": {
    "durMs": 600,
    "sigma": 20,
    "brightness": 0.15
   },
   "usage": [],
   "commonness": "中",
   "why": null,
   "source": "用户清单",
   "license": null,
   "domain": "render",
   "note": null,
   "originName": null
  },
  {
   "id": "effect.ice.frost",
   "label": "冰晶(近似)",
   "category": "in",
   "subclass": "特效",
   "aliases": [
    "冰块(入场)",
    "冰雪融化",
    "冰棱消散",
    "冰冻"
   ],
   "tier": "T1",
   "status": "可执行",
   "fxId": "effect.ice.frost",
   "params": {
    "durMs": 700
   },
   "usage": [],
   "commonness": "中",
   "why": null,
   "source": "用户清单",
   "license": null,
   "domain": "render",
   "note": "近似档(分册02 §3.3):真冰晶属拟物类不实现;此为冷调去饱和近似",
   "originName": null
  },
  {
   "id": "effect.light.streak",
   "label": "流光扫过",
   "category": "in",
   "subclass": "特效",
   "aliases": [
    "流金",
    "拉丝滑入",
    "光流喷射",
    "星芒收東"
   ],
   "tier": "T1",
   "status": "可执行",
   "fxId": "effect.light.streak",
   "params": {
    "dir": "h",
    "durMs": 600
   },
   "usage": [],
   "commonness": "中",
   "why": null,
   "source": "用户清单",
   "license": null,
   "domain": "render",
   "note": null,
   "originName": null
  },
  {
   "id": "effect.mosaic.dissolve",
   "label": "马赛克消融出场",
   "category": "out",
   "subclass": "特效",
   "aliases": [
    "多方格拼图",
    "马赛克(出场)",
    "块状消融",
    "网格消退"
   ],
   "tier": "T1",
   "status": "可执行",
   "fxId": "effect.mosaic.dissolve",
   "params": {
    "durMs": 600
   },
   "usage": [],
   "commonness": "中",
   "why": null,
   "source": "用户清单",
   "license": null,
   "domain": "render",
   "note": null,
   "originName": null
  },
  {
   "id": "effect.page.flip",
   "label": "翻页(透视近似)",
   "category": "in",
   "subclass": "特效",
   "aliases": [
    "胶片翻转",
    "拍立得翻转",
    "翻入",
    "右翻",
    "翻书",
    "打开书籍",
    "纸张展开",
    "纸张揭开",
    "折叠展开"
   ],
   "tier": "T1",
   "status": "可执行",
   "fxId": "effect.page.flip",
   "params": {
    "durMs": 600
   },
   "usage": [],
   "commonness": "中",
   "why": null,
   "source": "用户清单",
   "license": null,
   "domain": "render",
   "note": "近似档;真 3D 翻页 T2",
   "originName": null
  },
  {
   "id": "effect.pixel.reveal",
   "label": "像素扩散入场",
   "category": "in",
   "subclass": "特效",
   "aliases": [
    "像素扩散",
    "像索扩散",
    "马赛克入场",
    "像素湮灭"
   ],
   "tier": "T1",
   "status": "可执行",
   "fxId": "effect.pixel.reveal",
   "params": {
    "durMs": 600
   },
   "usage": [],
   "commonness": "中",
   "why": null,
   "source": "用户清单",
   "license": null,
   "domain": "render",
   "note": "像素族统一一条(含 马赛克/块状消融 同族合并)",
   "originName": null
  },
  {
   "id": "effect.speed.ramp",
   "label": "变速时空",
   "category": "in",
   "subclass": "特效",
   "aliases": [
    "变速时空"
   ],
   "tier": "T2",
   "status": "登记待实现",
   "fxId": "effect.speed.ramp",
   "params": {
    "durMs": 400
   },
   "usage": [],
   "commonness": "中",
   "why": "T2 候选(需着色器/素材/字幕侧逐元素表达);本轮未落地,登记待实现",
   "source": "用户清单",
   "license": null,
   "domain": "render",
   "note": "setpts 变速改段时长,与零漂移硬约束冲突;待 IR 变速区间表达升版",
   "originName": null,
   "owner": "第二册",
   "trigger": "IR 变速区间表达升版落地(零漂移口径在 schema 层重定义)",
   "degrade": "已注册 T2 占位:rs_fx.build_clip_fx 跳过该特效并 fxDegraded 留痕(不渲不报错);intent/verify 经 is_executable 判不可选;目录留痕=status=登记待实现"
  },
  {
   "id": "effect.split.grid",
   "label": "分屏网格入场",
   "category": "in",
   "subclass": "特效",
   "aliases": [
    "分屏翻转",
    "立方铺开",
    "网格渐进",
    "方块合并",
    "六列弹入",
    "条纹排列"
   ],
   "tier": "T2",
   "status": "登记待实现",
   "fxId": "effect.split.grid",
   "params": {
    "durMs": 600
   },
   "usage": [],
   "commonness": "中",
   "why": "T2 候选(需着色器/素材/字幕侧逐元素表达);本轮未落地,登记待实现",
   "source": "用户清单",
   "license": null,
   "domain": "render",
   "note": "xstack 分块错峰(>6 块成本显著上升,分册02 §3.3);待 fc 分块扩展",
   "originName": null,
   "owner": "第二册",
   "trigger": "fc 分块(xstack)扩展落地,并复核 >6 块的渲染成本",
   "degrade": "已注册 T2 占位:rs_fx.build_clip_fx 跳过该特效并 fxDegraded 留痕(不渲不报错);intent/verify 经 is_executable 判不可选;目录留痕=status=登记待实现"
  },
  {
   "id": "effect.tv.off",
   "label": "电视息屏",
   "category": "out",
   "subclass": "特效",
   "aliases": [
    "电视息屏",
    "关机"
   ],
   "tier": "T1",
   "status": "可执行",
   "fxId": "effect.tv.off",
   "params": {
    "durMs": 600
   },
   "usage": [],